{
  "provider": "claude-code",
  "reviewer_role": "verification",
  "billing_mode": "subscription-local",
  "api_key_usage_forbidden": true,
  "context_policy": {
    "start_mode": "fresh_context",
    "fork_conversation_context": false,
    "session_persistence": false,
    "input_mode": "review_packet"
  },
  "command": "claude -p <stdin> --output-format json --permission-mode default --tools \"\" --model opus --effort max --max-turns 3 --no-session-persistence",
  "execution_mode": "real",
  "permission_mode": "default",
  "prompt_transport": "stdin",
  "sandbox_mode": "require_escalated",
  "tools": "",
  "output_format": "json",
  "requested_model": "opus",
  "requested_effort": "max",
  "provider_models_used": [
    "claude-opus-4-8"
  ],
  "max_turns": 3,
  "timeout_seconds": 900,
  "started_at": "2026-06-22T10:00:00Z",
  "finished_at": "2026-06-22T10:01:00Z",
  "exit_code": 0,
  "raw_output_path": "",
  "raw_output_hash": "sha256:4c7d5d2aa7a32d944a4eb2018af9e00f59247b3571e1d19a5ad28e2a3c8dda40",
  "normalized_output_path": "reviewer-report.verification-claude.json",
  "normalized_output_hash": "sha256:df2280f5c71e69cf51a34f47258d6835d3609de4c6ff1e8a753aa029d2fc0774",
  "input_hash": "sha256:d2b808a00590400434afba7164bd3bfad2b2ed262d76c3f916ad00732628c626",
  "prompt_hash": "sha256:ca5d4e0a8a1ea364b9aaf7f0f067404a088e31cac4aea0903346569dd5beaa50",
  "review_prompt_contract_hash": "sha256:55f71b1f3160065845b3440f8e1343712821afbe647d4a5a325e824b51e8a5c4",
  "role_contract_hash": "sha256:d9efaf0a78cc2bf27c00fdbc7275ae930b31b7e1d8735f7e0957443354e5d6d0",
  "rubric_hash": "sha256:6f4853522c9387ff114beb3985058c8c5232e7fe343fbb31976310a5a8b00767",
  "schema_hash": "sha256:bfc1f5200138866c882b46a4bdabfeaf284dc2a7c9563fa3b4a1cd0cb7d9d2e5",
  "forbidden_env_checked": [
    "ANTHROPIC_API_KEY",
    "ANTHROPIC_AUTH_TOKEN",
    "ANTHROPIC_BASE_URL",
    "CLAUDE_CODE_USE_BEDROCK",
    "CLAUDE_CODE_USE_VERTEX"
  ],
  "wrapper": "scripts/reviewers/run_external_reviewer.py",
  "provider_config_path": "examples/external-reviewers/claude-code/claude-code.yaml",
  "provider_config_hash": "sha256:5fab30052ed512bf40b8a4e2866120d6352d8c55f5c2783d261513720d0daabd"
}
